{
  "quoteReference": "quoteRef1234",
  "customerReference": "custRef1234",
  "quoteType": "instalmentAmount",
  "quoteDate": "2021-05-13",
  "numberOfInstalments": 3,
  "totalDebtIncInt": 10,
  "interestAccrued": 10,
  "planInterest": 0.25,
  "totalInterest": 12.25,
  "instalments": [
    {
      "debtItemChargeId": "debtIChargeId1",
      "dueDate": "2021-05-13",
      "amountDue": 100,
      "expectedPayment": 100,
      "interestRate": 0.24,
      "instalmentNumber": 1,
      "instalmentInterestAccrued": 10,
      "instalmentBalance": 10
    },
    {
      "debtItemChargeId": "debtIChargeId2",
      "dueDate": "2021-05-13",
      "amountDue": 100,
      "expectedPayment": 100,
      "interestRate": 0.24,
      "instalmentNumber": 1,
      "instalmentInterestAccrued": 10,
      "instalmentBalance": 10
    },
    {
      "debtItemChargeId": "debtIChargeId3",
      "dueDate": "2021-05-13",
      "amountDue": 100,
      "expectedPayment": 100,
      "interestRate": 0.24,
      "instalmentNumber": 1,
      "instalmentInterestAccrued": 10,
      "instalmentBalance": 10,
      "interestCharge": 1.03
    }
  ],
  "collections": {
    "initialCollection": {
      "dueDate": "2022-06-18",
      "amountDue": 1000
    },
    "regularCollections": [
      {
        "dueDate": "2022-07-08",
        "amountDue": 1628.21
      },
      {
        "dueDate": "2022-08-08",
        "amountDue": 1628.21
      }
    ]
  }
}